{
  "schema_version": "codex-entry/v1",
  "id": "chill-zone-gather",
  "type": "mechanic",
  "title": "Chill-Zone Gather",
  "authority": "Akalynth",
  "author": "guardian@vaultmesh.org",
  "created": "2026-06-20T00:00:00Z",
  "updated": "2026-06-20T00:00:00Z",
  "status": "accepted",
  "visibility": {
    "builder": true,
    "operator": true,
    "agent": true,
    "public": false
  },
  "summary": "MVP no-combat micro-loop: move, gather a server-placed node, deliver to a station for a non-tradeable acknowledgment, emitting one delivery.recorded receipt per cycle. Smallest honest Recover loop, verifiable with existing movement + receipt tooling before any new system is added.",
  "lineage": {
    "origin": "gameplay-loop-designer session \u2014 MVP loop proposal (no source drop)",
    "accepted": true,
    "accepted_at": "2026-06-20T00:00:00Z",
    "last_accepted_change": "design review + server-spec step-1 mechanic packet accepted by codex-build-delegation 2026-06-20"
  },
  "world": {
    "description": "A no-combat chill-zone onboarding loop. The client sends only move/gather/deliver intents; the server owns the gather clock, inventory, and reward grant. One delivery.recorded receipt per completed cycle, with gather provenance folded in. Deliberately excludes combat, party mechanics, and tradeable economy so the Systems Bible pillars stay untouched. Placeholder intent/snapshot/receipt shapes must be reconciled with real game-server contracts (movement, inventory, receipt schema, Tem heat, zone snapshot) before implementation.",
    "design_refs": [
      "codex/design/chill-zone-gather.md",
      "codex/design/chill-zone-gather-step1-server-spec.md"
    ],
    "implementation": {
      "stage": "concept"
    }
  },
  "related": [
    {
      "rel": "references",
      "target": "game-loop-bible",
      "note": "Pre-Hour-1 instance of the primary Recover \u2192 Return beat, stripped to its smallest honest form."
    },
    {
      "rel": "references",
      "target": "systems-bible",
      "note": "Non-economic, combat-free \u2014 touches none of the six System Pillars' balance surfaces."
    }
  ],
  "packets": [
    {
      "kind": "review",
      "ref": "codex/design/chill-zone-gather.md",
      "status": "accepted"
    },
    {
      "kind": "mechanic",
      "ref": "codex/design/chill-zone-gather-step1-server-spec.md",
      "status": "accepted"
    }
  ],
  "public_projection": null,
  "tags": [
    "gameplay-loop",
    "mvp",
    "onboarding",
    "no-combat",
    "server-authority",
    "receipts",
    "proposal"
  ]
}
