{
  "schema_version": "codex-entry/v1",
  "id": "artifacts-codex",
  "type": "lore",
  "title": "Artifacts Codex",
  "authority": "Akalynth",
  "author": "guardian@vaultmesh.org",
  "created": "2026-06-12T00:00:00Z",
  "updated": "2026-06-12T00:00:00Z",
  "status": "accepted",
  "visibility": {
    "builder": true,
    "operator": true,
    "agent": true,
    "public": true
  },
  "summary": "Relics of Power.",
  "lineage": {
    "origin": "AKALYNTH_ARTIFACTS_CODEX_V1",
    "accepted": true,
    "accepted_at": "2026-06-12T00:00:00Z",
    "last_accepted_change": "AKALYNTH_ARTIFACTS_CODEX_V1"
  },
  "world": {
    "description": "Relics of Power.",
    "design_refs": [
      "repos/akalynth-site/drop/AKALYNTH_ASSET_LIBRARY_V1/markdown/AKALYNTH_ARTIFACTS_CODEX_V1.md"
    ]
  },
  "related": [
    {
      "rel": "references",
      "target": "heroes-codex"
    },
    {
      "rel": "references",
      "target": "chronicle-of-ages"
    }
  ],
  "assets": [
    {
      "kind": "plate",
      "path": "repos/akalynth-site/assets/codex/artifacts-codex.png"
    }
  ],
  "public_projection": {
    "published": true,
    "reviewed_by": "guardian@vaultmesh.org",
    "title": "Artifacts Codex",
    "category": "Codices",
    "summary": "Relics of Power.",
    "body": "Heroes change history, villains corrupt it, artifacts preserve it. Volume I gathers the eight Relics of Power, beginning with the First Codex — the oldest written record, said to update itself whenever the world changes.",
    "assets": [
      "assets/codex/artifacts-codex.png"
    ],
    "related": [
      "heroes-codex",
      "chronicle-of-ages"
    ],
    "source_ref": "artifacts-codex"
  },
  "tags": [
    "codex",
    "archive"
  ]
}
