{
  "schema_version": "codex-entry/v1",
  "id": "chronoshell-turtle",
  "type": "creature",
  "title": "The Chronoshell Turtle",
  "authority": "Akalynth",
  "author": "guardian@vaultmesh.org",
  "created": "2026-06-12T00:00:00Z",
  "updated": "2026-06-12T00:00:00Z",
  "status": "accepted",
  "visibility": {
    "builder": true,
    "operator": true,
    "agent": true,
    "public": true
  },
  "summary": "Keeper of Ages · Shell of Millennia",
  "lineage": {
    "origin": "codex.html creature codex",
    "accepted": true,
    "accepted_at": "2026-06-12T00:00:00Z",
    "last_accepted_change": "codex.html creature codex"
  },
  "world": {
    "description": "Keeper of Ages · Shell of Millennia · Threat: Unknown."
  },
  "related": [],
  "assets": [
    {
      "kind": "plate",
      "path": "repos/akalynth-site/assets/codex/chronoshell-turtle.png"
    }
  ],
  "public_projection": {
    "published": true,
    "reviewed_by": "guardian@vaultmesh.org",
    "title": "The Chronoshell Turtle",
    "category": "Creatures",
    "summary": "Keeper of Ages · Shell of Millennia · Threat: Unknown",
    "body": "An ancient turtle whose shell is said to hold millennia; time moves differently in its wake.",
    "assets": [
      "assets/codex/chronoshell-turtle.png"
    ],
    "related": [],
    "source_ref": "chronoshell-turtle"
  },
  "tags": [
    "creature",
    "threat-unknown"
  ]
}
