{
  "schema_version": "codex-entry/v1",
  "id": "chronicle-of-ages",
  "type": "lore",
  "title": "Chronicle of Ages",
  "authority": "Akalynth",
  "author": "guardian@vaultmesh.org",
  "created": "2026-06-12T00:00:00Z",
  "updated": "2026-06-12T00:00:00Z",
  "status": "accepted",
  "visibility": {
    "builder": true,
    "operator": true,
    "agent": true,
    "public": true
  },
  "summary": "Events That Changed The World.",
  "lineage": {
    "origin": "AKALYNTH_CHRONICLE_OF_AGES_V1",
    "accepted": true,
    "accepted_at": "2026-06-12T00:00:00Z",
    "last_accepted_change": "AKALYNTH_CHRONICLE_OF_AGES_V1"
  },
  "world": {
    "description": "Events That Changed The World.",
    "design_refs": [
      "repos/akalynth-site/drop/AKALYNTH_ASSET_LIBRARY_V1/markdown/AKALYNTH_CHRONICLE_OF_AGES_V1.md"
    ]
  },
  "related": [
    {
      "rel": "references",
      "target": "high-city"
    },
    {
      "rel": "references",
      "target": "heroes-codex"
    }
  ],
  "assets": [
    {
      "kind": "plate",
      "path": "repos/akalynth-site/assets/codex/chronicle-of-ages.png"
    }
  ],
  "public_projection": {
    "published": true,
    "reviewed_by": "guardian@vaultmesh.org",
    "title": "Chronicle of Ages",
    "category": "Codices",
    "summary": "Events That Changed The World.",
    "body": "Cities rise, heroes die, kingdoms vanish; what remains are the moments that changed everything. Volume I opens with the First Binding — the dawn of remembered civilization.",
    "assets": [
      "assets/codex/chronicle-of-ages.png"
    ],
    "related": [
      "high-city",
      "heroes-codex"
    ],
    "source_ref": "chronicle-of-ages"
  },
  "tags": [
    "codex",
    "archive"
  ]
}
